Job_Description,Class_Customercare
"The Web developer responsibilities include building a website from concept all the way to completion from the bottom up, putting together everything from the home page to site layout and function.Write well designed, testable, efficient code by using best software development practices.Create website layout/user interface by using standard HTML/CSS practices.Gather and refine specifications and requirements based on technical needs.Create and maintain software documentation.Be responsible for maintaining, expanding, and scaling a site.Stay plugged into emerging technologies/industry trends and apply them into operations and activities.",0
"We’re looking for bright energetic and out-of-the-box problem solvers to join our team. We specialize in development of web and mobile applications, information driven reporting solutions and ways to align technology solutions with business objectives. This development position exposes associates to both Web and Business Intelligence tools including web technologies, large scale databases, ETL and reporting tools. We seek to deliver beautiful, functional solutions that meet - and exceed - customers’ needs. Passion for technology and using it to solve business problems.Understanding of web software development technologies including HTML, CSS, XML, JSON and JavaScript. Experience working with modern JavaScript frameworks and libraries such as React JS, Vue JS, and React Native. Possess an understanding of the entire web development process, including design, development and deployment, and testing with some back-end knowledge
",0
"Engineers work with product managers to refine direction and solve user problems, exchange code reviews with other team members, provide mentorship to junior engineers, and assist QA and Ops in troubleshooting product issues. Our platform uses React + Redux and modern semantic HTML and CSS. While your focus will be on the front end, our teams are cross-discipline and we encourage learning outside your area of expertise and welcome contributions to other domains such as our backend microservices built using Python & Django.",0
"Be part of a dynamic team that is passionate about creating industry-changing, cloud-based applications and platforms. Solve real customer problems and experiment with new ideas. Decompose existing software systems while working with and influencing others to improve overall architecture.Collaborate with QA engineers to ensure accurate and comprehensive testing coverage.Contribute to troubleshooting and technical support of the product. Participate in all aspects of the software development life cycle",0
"As a Post Office Clerk, you are responsible for shipping and mailing of all mail over the counter. You will also be in charge of all purchases of supplies and mail accessories. You will work hands on with the public. You may also be required to handle bags of mail or parcel post weighing up to 70 pounds.",0
"Researches and compiles data, prepares statistical reports and maintains database records.Reviews and processes applications, forms, invoices, timesheets, and payroll and personnel documents.Assesses work flow, and organizes activities and operations.Prepares lists, records information on forms, completes and processes standard forms, documents, and reports and corrects mistakes.Assists in budget preparation and monitors and controls expenditures.Answers phone calls, provides information, takes messages, and routes calls.Enters, codes, stores, edits and retrieves database records and files.Organizes clerical operations for program activities, develops standard forms and form letters, performs research, and completes administrative projects",0
"As a Post Office Clerk, you are responsible for shipping and mailing of all mail over the counter. You will also be in charge of all purchases of supplies and mail accessories. You will work hands on with the public. You may also be required to handle bags of mail or parcel post weighing up to 70 pounds.",0
This is an entry level position responsible for maintaining designated mountain(s) invoicing workflows in accordance with payment terms. AP Data Entry Clerks will be working closely with internal and external stakeholders to ensure on time payment. This team is a crucial resource supporting of all aspects of Accounts Payable processing for the entire enterprise.,0
"Transfer data into computer files or database systems.Type in data provided directly from IMT Logistics Coordinator.Update spreadsheets with multiple name changes with 100% accuracy.Verify data by comparing it to source documents Working with hotel PIC to maintain guidelines set for hotel quarantine.Retrieve data from the database or electronic files as requested.Backup data to ensure data preservation.Sort and organize paperwork after entering data to ensure it is not lost.Engage and collaborate with on-site IMT members both internal and external to Danos Create and/or maintain databases and spreadsheets.Complete forms in accordance with company procedures",0